{
  "$schema": "../circuit.schema.json",
  "id": "plage",
  "name": "Plage au couchant",
  "description": "Rapide, le long de la mer : des virages en vagues, mouettes et dauphins.",
  "theme": "beach",
  "start": { "x": 8.5, "z": 94.8 },
  "corners": [
    { "x": -117.5, "z": 94.8, "radius": 35.5 },
    { "x": -117.5, "z": -31.9, "radius": 29.5 },
    { "x": -71.2, "z": -36.7, "radius": 30 },
    { "x": -50.9, "z": -65.4, "radius": 29.5 },
    { "x": -12.6, "z": -64.4, "radius": 30.5 },
    { "x": 9.2, "z": -94.9, "radius": 29.5 },
    { "x": 117.5, "z": -94.9, "radius": 33.5 },
    { "x": 117.5, "z": -39, "radius": 43 },
    { "x": 115.1, "z": -25, "radius": 29.5 },
    { "x": 80.4, "z": 5.1, "radius": 25 },
    { "x": 116.1, "z": 35.7, "radius": 29 },
    { "x": 118, "z": 55.7, "radius": 75.5 },
    { "x": 114.2, "z": 94.8, "radius": 33.5 }
  ],
  "decor": {
    "landmarks": [
      { "kind": "sandcastle", "x": -40, "z": 25, "radius": 7.5 },
      { "kind": "lifeguard-tower", "x": -30, "z": 122, "radius": 3.8 },
      { "kind": "beach-huts", "x": 55, "z": 124, "radius": 7.4 },
      { "kind": "beach-huts", "x": -90, "z": -80, "radius": 7.4 }
    ]
  }
}
