{
  "$schema": "../circuit.schema.json",
  "id": "colline",
  "name": "La Colline",
  "description": "Une longue montée vers la niche, un faux plat au sommet, puis la grande descente.",
  "theme": "garden",
  "start": { "x": 0, "z": -80 },
  "corners": [
    { "x": -120, "z": -80, "radius": 30, "y": 0 },
    { "x": -120, "z": 0, "y": 8 },
    { "x": -120, "z": 60, "radius": 25, "y": 12, "bank": 10 },
    { "x": 0, "z": 60, "y": 12 },
    { "x": 120, "z": 60, "radius": 30, "y": 6, "bank": 12 },
    { "x": 120, "z": -20, "radius": 25, "y": 3 },
    { "x": 90, "z": -80, "radius": 25, "y": 0 }
  ],
  "decor": {
    "landmarks": [
      { "kind": "doghouse", "x": -60, "z": 25, "radius": 5.5 },
      { "kind": "kibble-bowl", "x": 60, "z": -20, "radius": 4.4 },
      { "kind": "watering-can", "x": -165, "z": -20, "radius": 6.2 },
      { "kind": "gnome", "x": 0, "z": 100, "radius": 2.8 }
    ]
  }
}
